2023,8,OH,PSA Airlines Inc.,STL,"St. Louis, MO: St Louis Lambert International",39.0,8.0,3.53,0.0,1.51,0.0,2.95,0.0,0.0,457.0,180.0,0.0,54.0,0.0,223.0
2023,8,OH,PSA Airlines Inc.,SYR,"Syracuse, NY: Syracuse Hancock International",53.0,7.0,2.55,1.0,0.0,0.0,3.45,0.0,0.0,490.0,103.0,23.0,0.0,0.0,364.0
2023,8,OH,PSA Airlines Inc.,TLH,"Tallahassee, FL: Tallahassee International",89.0,24.0,4.76,1.89,6.57,0.0,10.77,8.0,1.0,1998.0,869.0,100.0,249.0,0.0,780.0
2023,8,OH,PSA Airlines Inc.,TRI,"Bristol/Johnson City/Kingsport, TN: Tri Cities",18.0,5.0,0.1,0.98,1.0,0.0,2.92,1.0,0.0,464.0,31.0,84.0,20.0,0.0,329.0
2023,8,OH,PSA Airlines Inc.,TUL,"Tulsa, OK: Tulsa International",82.0,14.0,6.27,1.0,1.82,0.0,4.91,1.0,0.0,1346.0,483.0,20.0,93.0,0.0,750.0
2023,8,OH,PSA Airlines Inc.,TVC,"Traverse City, MI: Cherry Capital",3.0,1.0,0.71,0.0,0.0,0.0,0.29,0.0,0.0,17.0,12.0,0.0,0.0,0.0,5.0
2023,8,OH,PSA Airlines Inc.,TYS,"Knoxville, TN: McGhee Tyson",296.0,68.0,21.62,5.35,20.44,0.0,20.59,4.0,0.0,3146.0,844.0,267.0,649.0,0.0,1386.0
2023,8,OH,PSA Airlines Inc.,VPS,"Valparaiso, FL: Eglin AFB Destin Fort Walton Beach",21.0,5.0,0.43,0.6,1.56,0.57,1.84,0.0,0.0,344.0,12.0,133.0,122.0,16.0,61.0
2023,8,OH,PSA Airlines Inc.,XNA,"Fayetteville, AR: Northwest Arkansas National",2.0,1.0,0.0,0.71,0.12,0.0,0.18,0.0,0.0,34.0,0.0,24.0,4.0,0.0,6.0
2023,8,OO,SkyWest Airlines Inc.,ABE,"Allentown/Bethlehem/Easton, PA: Lehigh Valley International",62.0,16.0,8.0,1.0,1.0,0.0,6.0,2.0,0.0,978.0,395.0,87.0,21.0,0.0,475.0
2023,8,OO,SkyWest Airlines Inc.,ABQ,"Albuquerque, NM: Albuquerque International Sunport",313.0,22.0,17.0,3.0,0.0,0.0,2.0,0.0,0.0,1365.0,729.0,179.0,0.0,0.0,457.0
2023,8,OO,SkyWest Airlines Inc.,ABR,"Aberdeen, SD: Aberdeen Regional",62.0,16.0,11.0,5.0,0.0,0.0,0.0,0.0,1.0,690.0,494.0,196.0,0.0,0.0,0.0
2023,8,OO,SkyWest Airlines Inc.,ACT,"Waco, TX: Waco Regional",93.0,12.0,9.0,0.0,0.0,0.0,3.0,2.0,0.0,768.0,676.0,0.0,0.0,0.0,92.0
2023,8,OO,SkyWest Airlines Inc.,ACV,"Arcata/Eureka, CA: California Redwood Coast Humboldt County",88.0,12.0,6.0,3.0,1.0,0.0,2.0,0.0,2.0,1566.0,206.0,1246.0,16.0,0.0,98.0
2023,8,OO,SkyWest Airlines Inc.,AEX,"Alexandria, LA: Alexandria International",93.0,15.0,14.0,0.0,0.0,0.0,1.0,0.0,0.0,1820.0,1675.0,0.0,0.0,0.0,145.0
2023,8,OO,SkyWest Airlines Inc.,AGS,"Augusta, GA: Augusta Regional at Bush Field",106.0,25.0,18.0,7.0,0.0,0.0,0.0,1.0,0.0,1965.0,1235.0,730.0,0.0,0.0,0.0
2023,8,OO,SkyWest Airlines Inc.,ALB,"Albany, NY: Albany International",55.0,6.0,4.0,2.0,0.0,0.0,0.0,1.0,0.0,286.0,154.0,132.0,0.0,0.0,0.0
2023,8,OO,SkyWest Airlines Inc.,ALW,"Walla Walla, WA: Walla Walla Regional",31.0,4.0,2.0,0.0,0.0,0.0,2.0,0.0,0.0,250.0,55.0,0.0,0.0,0.0,195.0
2023,8,OO,SkyWest Airlines Inc.,AMA,"Amarillo, TX: Rick Husband Amarillo International",130.0,29.0,18.0,2.0,0.0,1.0,8.0,1.0,0.0,2356.0,1483.0,163.0,0.0,23.0,687.0
2023,8,OO,SkyWest Airlines Inc.,APN,"Alpena, MI: Alpena County Regional",27.0,2.0,2.0,0.0,0.0,0.0,0.0,1.0,1.0,140.0,140.0,0.0,0.0,0.0,0.0
2023,8,OO,SkyWest Airlines Inc.,ASE,"Aspen, CO: Aspen Pitkin County Sardy Field",627.0,129.0,86.0,1.0,3.0,0.0,39.0,4.0,10.0,9556.0,5177.0,42.0,151.0,0.0,4186.0
2023,8,OO,SkyWest Airlines Inc.,ATL,"Atlanta, GA: Hartsfield-Jackson Atlanta International",627.0,120.0,80.0,34.0,6.0,0.0,0.0,8.0,6.0,12069.0,7267.0,4377.0,425.0,0.0,0.0
2023,8,OO,SkyWest Airlines Inc.,ATW,"Appleton, WI: Appleton International",318.0,71.0,54.0,3.0,1.0,0.0,13.0,1.0,1.0,5460.0,3719.0,92.0,55.0,0.0,1594.0
2023,8,OO,SkyWest Airlines Inc.,AUS,"Austin, TX: Austin - Bergstrom International",202.0,57.0,38.0,0.0,1.0,0.0,18.0,0.0,3.0,5903.0,4637.0,0.0,39.0,0.0,1227.0
2023,8,OO,SkyWest Airlines Inc.,AVL,"Asheville, NC: Asheville Regional",66.0,22.0,11.0,0.0,1.0,0.0,10.0,1.0,0.0,965.0,500.0,0.0,18.0,0.0,447.0
2023,8,OO,SkyWest Airlines Inc.,AVP,"Scranton/Wilkes-Barre, PA: Wilkes Barre Scranton International",62.0,21.0,15.0,1.0,0.0,0.0,5.0,1.0,0.0,1575.0,768.0,92.0,0.0,0.0,715.0
2023,8,OO,SkyWest Airlines Inc.,BDL,"Hartford, CT: Bradley International",18.0,4.0,3.0,0.0,0.0,0.0,1.0,1.0,0.0,334.0,294.0,0.0,0.0,0.0,40.0
2023,8,OO,SkyWest Airlines Inc.,BFF,"Scottsbluff, NE: Western Neb. Regional/William B. Heilig Field",35.0,8.0,5.0,1.0,0.0,0.0,2.0,1.0,0.0,906.0,811.0,43.0,0.0,0.0,52.0
2023,8,OO,SkyWest Airlines Inc.,BFL,"Bakersfield, CA: Meadows Field",151.0,13.0,8.0,2.0,1.0,0.0,2.0,0.0,1.0,547.0,365.0,41.0,62.0,0.0,79.0
2023,8,OO,SkyWest Airlines Inc.,BGR,"Bangor, ME: Bangor International",31.0,6.0,2.0,0.0,0.0,0.0,4.0,0.0,0.0,220.0,92.0,0.0,0.0,0.0,128.0
2023,8,OO,SkyWest Airlines Inc.,BHM,"Birmingham, AL: Birmingham-Shuttlesworth International",216.0,45.0,33.0,5.0,2.0,0.0,5.0,2.0,4.0,2551.0,1693.0,238.0,127.0,0.0,493.0
2023,8,OO,SkyWest Airlines Inc.,BIH,"Bishop, CA: Bishop Airport",31.0,3.0,2.0,0.0,0.0,0.0,1.0,1.0,0.0,332.0,302.0,0.0,0.0,0.0,30.0
2023,8,OO,SkyWest Airlines Inc.,BIL,"Billings, MT: Billings Logan International",83.0,14.0,7.0,3.0,0.0,0.0,4.0,0.0,1.0,545.0,339.0,83.0,0.0,0.0,123.0
2023,8,OO,SkyWest Airlines Inc.,BIS,"Bismarck/Mandan, ND: Bismarck Municipal",186.0,28.0,17.0,1.0,0.0,0.0,10.0,0.0,0.0,2110.0,1115.0,181.0,0.0,0.0,814.0
2023,8,OO,SkyWest Airlines Inc.,BJI,"Bemidji, MN: Bemidji Regional",60.0,2.0,1.0,1.0,0.0,0.0,0.0,0.0,0.0,258.0,50.0,208.0,0.0,0.0,0.0
2023,8,OO,SkyWest Airlines Inc.,BLI,"Bellingham, WA: Bellingham International",62.0,11.0,5.0,0.0,0.0,0.0,6.0,0.0,0.0,350.0,145.0,0.0,0.0,0.0,205.0
2023,8,OO,SkyWest Airlines Inc.,BMI,"Bloomington/Normal, IL: Central Il Regional Airport at Bloomington",70.0,16.0,12.0,4.0,0.0,0.0,0.0,1.0,1.0,1348.0,771.0,577.0,0.0,0.0,0.0
2023,8,OO,SkyWest Airlines Inc.,BNA,"Nashville, TN: Nashville International",155.0,31.0,19.0,6.0,2.0,0.0,4.0,1.0,0.0,1851.0,911.0,596.0,134.0,0.0,210.0
2023,8,OO,SkyWest Airlines Inc.,BOI,"Boise, ID: Boise Air Terminal",737.0,133.0,62.0,11.0,9.0,0.0,51.0,1.0,4.0,7529.0,2712.0,327.0,268.0,0.0,4222.0
2023,8,OO,SkyWest Airlines Inc.,BOS,"Boston, MA: Logan International",152.0,41.0,17.0,11.0,13.0,0.0,0.0,4.0,1.0,3060.0,1229.0,916.0,915.0,0.0,0.0
2023,8,OO,SkyWest Airlines Inc.,BPT,"Beaumont/Port Arthur, TX: Jack Brooks Regional",62.0,6.0,5.0,0.0,0.0,0.0,1.0,1.0,0.0,284.0,227.0,0.0,0.0,0.0,57.0
2023,8,OO,SkyWest Airlines Inc.,BRD,"Brainerd, MN: Brainerd Lakes Regional",53.0,2.0,2.0,0.0,0.0,0.0,0.0,0.0,1.0,95.0,95.0,0.0,0.0,0.0,0.0
2023,8,OO,SkyWest Airlines Inc.,BRO,"Brownsville, TX: Brownsville South Padre Island International",31.0,5.0,4.0,0.0,0.0,0.0,1.0,0.0,0.0,269.0,248.0,0.0,0.0,0.0,21.0
2023,8,OO,SkyWest Airlines Inc.,BTM,"Butte, MT: Bert Mooney",57.0,3.0,2.0,1.0,0.0,0.0,0.0,0.0,2.0,159.0,119.0,40.0,0.0,0.0,0.0
2023,8,OO,SkyWest Airlines Inc.,BTR,"Baton Rouge, LA: Baton Rouge Metropolitan/Ryan Field",77.0,14.0,9.0,0.0,0.0,0.0,5.0,1.0,0.0,724.0,421.0,0.0,0.0,0.0,303.0
2023,8,OO,SkyWest Airlines Inc.,BUF,"Buffalo, NY: Buffalo Niagara International",55.0,15.0,13.0,1.0,0.0,0.0,1.0,1.0,0.0,1533.0,1348.0,151.0,0.0,0.0,34.0
2023,8,OO,SkyWest Airlines Inc.,BUR,"Burbank, CA: Bob Hope",297.0,32.0,18.0,4.0,1.0,0.0,9.0,3.0,2.0,1923.0,636.0,303.0,108.0,0.0,876.0
2023,8,OO,SkyWest Airlines Inc.,BZN,"Bozeman, MT: Bozeman Yellowstone International",121.0,15.0,10.0,2.0,0.0,0.0,3.0,0.0,0.0,701.0,331.0,181.0,0.0,0.0,189.0
2023,8,OO,SkyWest Airlines Inc.,CAE,"Columbia, SC: Columbia Metropolitan",63.0,17.0,10.0,2.0,0.0,0.0,5.0,1.0,0.0,936.0,335.0,207.0,0.0,0.0,394.0
2023,8,OO,SkyWest Airlines Inc.,CAK,"Akron, OH: Akron-Canton Regional",84.0,28.0,22.0,0.0,1.0,0.0,5.0,0.0,1.0,1480.0,891.0,0.0,88.0,0.0,501.0
2023,8,OO,SkyWest Airlines Inc.,CDC,"Cedar City, UT: Cedar City Regional",53.0,3.0,3.0,0.0,0.0,0.0,0.0,0.0,0.0,167.0,167.0,0.0,0.0,0.0,0.0
2023,8,OO,SkyWest Airlines Inc.,CHA,"Chattanooga, TN: Lovell Field",102.0,16.0,10.0,0.0,1.0,0.0,5.0,1.0,0.0,791.0,488.0,0.0,39.0,0.0,264.0
2023,8,OO,SkyWest Airlines Inc.,CHO,"Charlottesville, VA: Charlottesville Albemarle",31.0,7.0,4.0,0.0,2.0,0.0,1.0,0.0,0.0,418.0,103.0,0.0,268.0,0.0,47.0
2023,8,OO,SkyWest Airlines Inc.,CHS,"Charleston, SC: Charleston AFB/International",7.0,1.0,1.0,0.0,0.0,0.0,0.0,0.0,0.0,20.0,20.0,0.0,0.0,0.0,0.0
2023,8,OO,SkyWest Airlines Inc.,CID,"Cedar Rapids/Iowa City, IA: The Eastern Iowa",83.0,4.0,3.0,0.0,1.0,0.0,0.0,0.0,0.0,141.0,122.0,0.0,19.0,0.0,0.0
2023,8,OO,SkyWest Airlines Inc.,CIU,"Sault Ste. Marie, MI: Chippewa County International",62.0,12.0,9.0,2.0,1.0,0.0,0.0,0.0,1.0,3031.0,2201.0,776.0,54.0,0.0,0.0
2023,8,OO,SkyWest Airlines Inc.,CLE,"Cleveland, OH: Cleveland-Hopkins International",149.0,19.0,8.0,5.0,3.0,0.0,3.0,2.0,1.0,1621.0,426.0,656.0,353.0,0.0,186.0
2023,8,OO,SkyWest Airlines Inc.,CLL,"College Station/Bryan, TX: Easterwood Field",50.0,4.0,4.0,0.0,0.0,0.0,0.0,1.0,0.0,298.0,298.0,0.0,0.0,0.0,0.0
2023,8,OO,SkyWest Airlines Inc.,CLT,"Charlotte, NC: Charlotte Douglas International",4.0,0.0,0.0,0.0,0.0,0.0,0.0,0.0,0.0,0.0,0.0,0.0,0.0,0.0,0.0
2023,8,OO,SkyWest Airlines Inc.,CMH,"Columbus, OH: John Glenn Columbus International",100.0,9.0,8.0,1.0,0.0,0.0,0.0,1.0,0.0,472.0,409.0,63.0,0.0,0.0,0.0
2023,8,OO,SkyWest Airlines Inc.,CMX,"Hancock/Houghton, MI: Houghton County Memorial",62.0,14.0,11.0,1.0,0.0,0.0,2.0,2.0,2.0,709.0,352.0,45.0,0.0,0.0,312.0
2023,8,OO,SkyWest Airlines Inc.,CNY,"Moab, UT: Canyonlands Regional",52.0,9.0,6.0,0.0,0.0,0.0,3.0,0.0,1.0,344.0,201.0,0.0,0.0,0.0,143.0
2023,8,OO,SkyWest Airlines Inc.,COS,"Colorado Springs, CO: City of Colorado Springs Municipal",399.0,90.0,61.0,0.0,2.0,0.0,27.0,7.0,2.0,5706.0,3494.0,0.0,143.0,0.0,2069.0
2023,8,OO,SkyWest Airlines Inc.,COU,"Columbia, MO: Columbia Regional",12.0,0.0,0.0,0.0,0.0,0.0,0.0,0.0,0.0,0.0,0.0,0.0,0.0,0.0,0.0
2023,8,OO,SkyWest Airlines Inc.,CPR,"Casper, WY: Casper/Natrona County International",156.0,42.0,25.0,0.0,0.0,0.0,17.0,2.0,1.0,2455.0,1483.0,0.0,0.0,0.0,972.0
2023,8,OO,SkyWest Airlines Inc.,CRW,"Charleston/Dunbar, WV: West Virginia International Yeager",177.0,33.0,23.0,5.0,0.0,0.0,5.0,4.0,0.0,2940.0,1600.0,1090.0,0.0,0.0,250.0
2023,8,OO,SkyWest Airlines Inc.,CVG,"Cincinnati, OH: Cincinnati/Northern Kentucky International",15.0,3.0,2.0,0.0,0.0,0.0,1.0,0.0,0.0,102.0,36.0,0.0,0.0,0.0,66.0
2023,8,OO,SkyWest Airlines Inc.,DAY,"Dayton, OH: James M Cox/Dayton International",151.0,18.0,11.0,0.0,0.0,0.0,7.0,1.0,0.0,1197.0,343.0,0.0,0.0,0.0,854.0
2023,8,OO,SkyWest Airlines Inc.,DCA,"Washington, DC: Ronald Reagan Washington National",40.0,7.0,3.0,1.0,0.0,0.0,3.0,0.0,0.0,336.0,178.0,24.0,0.0,0.0,134.0
2023,8,OO,SkyWest Airlines Inc.,DDC,"Dodge City, KS: Dodge City Regional",53.0,8.0,5.0,0.0,0.0,0.0,3.0,0.0,0.0,353.0,186.0,0.0,0.0,0.0,167.0
2023,8,OO,SkyWest Airlines Inc.,DEC,"Decatur, IL: Decatur Airport",84.0,20.0,12.0,3.0,0.0,0.0,5.0,2.0,0.0,2076.0,1389.0,335.0,0.0,0.0,352.0
2023,8,OO,SkyWest Airlines Inc.,DEN,"Denver, CO: Denver International",4267.0,929.0,549.0,95.0,100.0,1.0,184.0,35.0,32.0,80261.0,47776.0,7752.0,8804.0,18.0,15911.0
2023,8,OO,SkyWest Airlines Inc.,DFW,"Dallas/Fort Worth, TX: Dallas/Fort Worth International",2339.0,306.0,230.0,16.0,7.0,1.0,52.0,15.0,8.0,40496.0,34952.0,1978.0,340.0,24.0,3202.0
2023,8,OO,SkyWest Airlines Inc.,DIK,"Dickinson, ND: Dickinson - Theodore Roosevelt Regional",53.0,15.0,10.0,2.0,1.0,0.0,2.0,0.0,1.0,1508.0,526.0,766.0,122.0,0.0,94.0
2023,8,OO,SkyWest Airlines Inc.,DLH,"Duluth, MN: Duluth International",130.0,18.0,14.0,2.0,0.0,0.0,2.0,1.0,0.0,936.0,470.0,210.0,0.0,0.0,256.0
2023,8,OO,SkyWest Airlines Inc.,DRO,"Durango, CO: Durango La Plata County",293.0,35.0,25.0,1.0,0.0,1.0,8.0,2.0,2.0,2146.0,1554.0,103.0,0.0,21.0,468.0
2023,8,OO,SkyWest Airlines Inc.,DSM,"Des Moines, IA: Des Moines International",73.0,13.0,12.0,0.0,0.0,0.0,1.0,1.0,0.0,1296.0,1166.0,0.0,0.0,0.0,130.0
2023,8,OO,SkyWest Airlines Inc.,DTW,"Detroit, MI: Detroit Metro Wayne County",1621.0,280.0,188.0,74.0,7.0,1.0,10.0,27.0,1.0,29276.0,19869.0,7786.0,870.0,24.0,727.0
2023,8,OO,SkyWest Airlines Inc.,DVL,"Devils Lake, ND: Devils Lake Regional",57.0,9.0,6.0,0.0,0.0,0.0,3.0,0.0,0.0,1712.0,1382.0,0.0,0.0,0.0,330.0
2023,8,OO,SkyWest Airlines Inc.,ECP,"Panama City, FL: Northwest Florida Beaches International",14.0,4.0,4.0,0.0,0.0,0.0,0.0,0.0,0.0,261.0,261.0,0.0,0.0,0.0,0.0
2023,8,OO,SkyWest Airlines Inc.,EGE,"Eagle, CO: Eagle County Regional",93.0,16.0,8.0,3.0,0.0,0.0,5.0,0.0,0.0,1434.0,345.0,863.0,0.0,0.0,226.0
2023,8,OO,SkyWest Airlines Inc.,EKO,"Elko, NV: Elko Regional",31.0,2.0,2.0,0.0,0.0,0.0,0.0,0.0,0.0,86.0,86.0,0.0,0.0,0.0,0.0
2023,8,OO,SkyWest Airlines Inc.,ELM,"Elmira/Corning, NY: Elmira/Corning Regional",62.0,8.0,6.0,2.0,0.0,0.0,0.0,0.0,0.0,541.0,319.0,222.0,0.0,0.0,0.0
2023,8,OO,SkyWest Airlines Inc.,ELP,"El Paso, TX: El Paso International",125.0,10.0,8.0,0.0,0.0,1.0,1.0,0.0,2.0,410.0,354.0,0.0,0.0,35.0,21.0
2023,8,OO,SkyWest Airlines Inc.,ESC,"Escanaba, MI: Delta County",62.0,7.0,6.0,1.0,0.0,0.0,0.0,0.0,0.0,705.0,273.0,432.0,0.0,0.0,0.0
2023,8,OO,SkyWest Airlines Inc.,EUG,"Eugene, OR: Mahlon Sweet Field",248.0,26.0,13.0,3.0,2.0,0.0,8.0,0.0,0.0,1008.0,492.0,118.0,57.0,0.0,341.0
2023,8,OO,SkyWest Airlines Inc.,EVV,"Evansville, IN: Evansville Regional",8.0,0.0,0.0,0.0,0.0,0.0,0.0,0.0,0.0,0.0,0.0,0.0,0.0,0.0,0.0
2023,8,OO,SkyWest Airlines Inc.,EWR,"Newark, NJ: Newark Liberty International",2.0,0.0,0.0,0.0,0.0,0.0,0.0,0.0,0.0,0.0,0.0,0.0,0.0,0.0,0.0
2023,8,OO,SkyWest Airlines Inc.,FAR,"Fargo, ND: Hector International",215.0,42.0,26.0,2.0,1.0,0.0,13.0,1.0,1.0,2178.0,1141.0,108.0,31.0,0.0,898.0
2023,8,OO,SkyWest Airlines Inc.,FAT,"Fresno, CA: Fresno Yosemite International",498.0,70.0,36.0,1.0,2.0,0.0,31.0,1.0,0.0,5284.0,2909.0,65.0,43.0,0.0,2267.0
2023,8,OO,SkyWest Airlines Inc.,FAY,"Fayetteville, NC: Fayetteville Regional/Grannis Field",29.0,1.0,1.0,0.0,0.0,0.0,0.0,0.0,2.0,20.0,20.0,0.0,0.0,0.0,0.0
2023,8,OO,SkyWest Airlines Inc.,FCA,"Kalispell, MT: Glacier Park International",199.0,21.0,15.0,3.0,0.0,0.0,3.0,1.0,1.0,777.0,604.0,65.0,0.0,0.0,108.0
2023,8,OO,SkyWest Airlines Inc.,FLG,"Flagstaff, AZ: Flagstaff Pulliam",123.0,15.0,11.0,1.0,0.0,0.0,3.0,0.0,0.0,828.0,584.0,85.0,0.0,0.0,159.0
2023,8,OO,SkyWest Airlines Inc.,FNT,"Flint, MI: Bishop International",26.0,3.0,2.0,0.0,0.0,0.0,1.0,0.0,0.0,195.0,125.0,0.0,0.0,0.0,70.0
2023,8,OO,SkyWest Airlines Inc.,FOD,"Fort Dodge, IA: Fort Dodge Regional",53.0,13.0,6.0,1.0,0.0,0.0,6.0,1.0,0.0,693.0,391.0,86.0,0.0,0.0,216.0
2023,8,OO,SkyWest Airlines Inc.,FSD,"Sioux Falls, SD: Joe Foss Field",163.0,28.0,21.0,1.0,2.0,0.0,4.0,0.0,0.0,1253.0,763.0,67.0,42.0,0.0,381.0
2023,8,OO,SkyWest Airlines Inc.,FSM,"Fort Smith, AR: Fort Smith Regional",29.0,1.0,0.0,0.0,0.0,0.0,1.0,0.0,0.0,23.0,0.0,0.0,0.0,0.0,23.0
2023,8,OO,SkyWest Airlines Inc.,FWA,"Fort Wayne, IN: Fort Wayne International",200.0,26.0,18.0,6.0,0.0,0.0,2.0,3.0,0.0,1658.0,990.0,520.0,0.0,0.0,148.0
2023,8,OO,SkyWest Airlines Inc.,GCC,"Gillette, WY: Northeast Wyoming Regional",52.0,14.0,4.0,1.0,0.0,1.0,8.0,0.0,0.0,797.0,140.0,36.0,0.0,28.0,593.0
2023,8,OO,SkyWest Airlines Inc.,GCK,"Garden City, KS: Garden City Regional",62.0,8.0,6.0,2.0,0.0,0.0,0.0,0.0,0.0,681.0,570.0,111.0,0.0,0.0,0.0
2023,8,OO,SkyWest Airlines Inc.,GEG,"Spokane, WA: Spokane International",298.0,30.0,21.0,4.0,2.0,0.0,3.0,0.0,0.0,1347.0,1065.0,134.0,59.0,0.0,89.0
2023,8,OO,SkyWest Airlines Inc.,GFK,"Grand Forks, ND: Grand Forks International",92.0,9.0,7.0,2.0,0.0,0.0,0.0,0.0,0.0,275.0,213.0,62.0,0.0,0.0,0.0
2023,8,OO,SkyWest Airlines Inc.,GGG,"Longview, TX: East Texas Regional",62.0,3.0,3.0,0.0,0.0,0.0,0.0,1.0,0.0,531.0,531.0,0.0,0.0,0.0,0.0
2023,8,OO,SkyWest Airlines Inc.,GJT,"Grand Junction, CO: Grand Junction Regional",112.0,18.0,13.0,0.0,0.0,0.0,5.0,0.0,0.0,1426.0,1011.0,0.0,0.0,0.0,415.0
2023,8,OO,SkyWest Airlines Inc.,GNV,"Gainesville, FL: Gainesville Regional",22.0,2.0,2.0,0.0,0.0,0.0,0.0,0.0,0.0,66.0,66.0,0.0,0.0,0.0,0.0
2023,8,OO,SkyWest Airlines Inc.,GPT,"Gulfport/Biloxi, MS: Gulfport-Biloxi International",3.0,0.0,0.0,0.0,0.0,0.0,0.0,0.0,0.0,0.0,0.0,0.0,0.0,0.0,0.0
2023,8,OO,SkyWest Airlines Inc.,GRB,"Green Bay, WI: Green Bay Austin Straubel International",322.0,60.0,37.0,5.0,2.0,0.0,16.0,4.0,0.0,3336.0,1415.0,417.0,105.0,0.0,1399.0
2023,8,OO,SkyWest Airlines Inc.,GRI,"Grand Island, NE: Central Nebraska Regional",62.0,6.0,5.0,1.0,0.0,0.0,0.0,2.0,0.0,377.0,338.0,39.0,0.0,0.0,0.0
2023,8,OO,SkyWest Airlines Inc.,GRK,"Killeen, TX: Robert Gray AAF",42.0,4.0,3.0,1.0,0.0,0.0,0.0,0.0,0.0,280.0,188.0,92.0,0.0,0.0,0.0
2023,8,OO,SkyWest Airlines Inc.,GRR,"Grand Rapids, MI: Gerald R. Ford International",57.0,6.0,5.0,0.0,0.0,0.0,1.0,1.0,0.0,350.0,277.0,0.0,0.0,0.0,73.0
2023,8,OO,SkyWest Airlines Inc.,GSO,"Greensboro/High Point, NC: Piedmont Triad International",62.0,11.0,4.0,0.0,0.0,0.0,7.0,1.0,0.0,571.0,181.0,0.0,0.0,0.0,390.0
2023,8,OO,SkyWest Airlines Inc.,GSP,"Greer, SC: Greenville-Spartanburg International",66.0,10.0,8.0,0.0,0.0,0.0,2.0,0.0,0.0,645.0,408.0,0.0,0.0,0.0,237.0
2023,8,OO,SkyWest Airlines Inc.,GTF,"Great Falls, MT: Great Falls International",155.0,13.0,8.0,1.0,0.0,0.0,4.0,0.0,0.0,558.0,200.0,195.0,0.0,0.0,163.0
2023,8,OO,SkyWest Airlines Inc.,GTR,"Columbus, MS: Golden Triangle Regional",5.0,2.0,2.0,0.0,0.0,0.0,0.0,0.0,0.0,102.0,102.0,0.0,0.0,0.0,0.0
2023,8,OO,SkyWest Airlines Inc.,GUC,"Gunnison, CO: Gunnison-Crested Butte Regional",62.0,7.0,3.0,0.0,0.0,0.0,4.0,0.0,0.0,517.0,133.0,0.0,0.0,0.0,384.0
2023,8,OO,SkyWest Airlines Inc.,HDN,"Hayden, CO: Yampa Valley",101.0,21.0,11.0,0.0,1.0,0.0,9.0,0.0,1.0,2366.0,558.0,0.0,52.0,0.0,1756.0
2023,8,OO,SkyWest Airlines Inc.,HIB,"Hibbing, MN: Range Regional",52.0,5.0,4.0,1.0,0.0,0.0,0.0,0.0,0.0,364.0,341.0,23.0,0.0,0.0,0.0
2023,8,OO,SkyWest Airlines Inc.,HLN,"Helena, MT: Helena Regional",155.0,19.0,15.0,1.0,0.0,0.0,3.0,0.0,0.0,1157.0,813.0,96.0,0.0,0.0,248.0
2023,8,OO,SkyWest Airlines Inc.,HOU,"Houston, TX: William P Hobby",55.0,9.0,6.0,0.0,1.0,0.0,2.0,0.0,0.0,562.0,438.0,0.0,62.0,0.0,62.0
2023,8,OO,SkyWest Airlines Inc.,HPN,"White Plains, NY: Westchester County",265.0,54.0,43.0,8.0,0.0,0.0,3.0,3.0,0.0,3547.0,2728.0,706.0,0.0,0.0,113.0
2023,8,OO,SkyWest Airlines Inc.,HRL,"Harlingen/San Benito, TX: Valley International",7.0,0.0,0.0,0.0,0.0,0.0,0.0,0.0,0.0,0.0,0.0,0.0,0.0,0.0,0.0
2023,8,OO,SkyWest Airlines Inc.,HSV,"Huntsville, AL: Huntsville International-Carl T Jones Field",138.0,44.0,31.0,4.0,1.0,0.0,8.0,0.0,1.0,2653.0,1415.0,409.0,47.0,0.0,782.0
2023,8,OO,SkyWest Airlines Inc.,HYS,"Hays, KS: Hays Regional",62.0,11.0,7.0,0.0,0.0,0.0,4.0,0.0,0.0,1079.0,439.0,0.0,0.0,0.0,640.0
2023,8,OO,SkyWest Airlines Inc.,IAD,"Washington, DC: Washington Dulles International",266.0,35.0,27.0,5.0,3.0,0.0,0.0,6.0,0.0,2105.0,1376.0,241.0,488.0,0.0,0.0
2023,8,OO,SkyWest Airlines Inc.,IAH,"Houston, TX: George Bush Intercontinental/Houston",833.0,131.0,84.0,3.0,0.0,0.0,44.0,2.0,1.0,13713.0,8036.0,284.0,0.0,0.0,5393.0
2023,8,OO,SkyWest Airlines Inc.,ICT,"Wichita, KS: Wichita Dwight D Eisenhower National",221.0,39.0,24.0,2.0,1.0,0.0,12.0,0.0,0.0,3643.0,2566.0,101.0,42.0,0.0,934.0
2023,8,OO,SkyWest Airlines Inc.,IDA,"Idaho Falls, ID: Idaho Falls Regional",248.0,37.0,26.0,2.0,0.0,0.0,9.0,3.0,0.0,2129.0,1416.0,44.0,0.0,0.0,669.0
2023,8,OO,SkyWest Airlines Inc.,IMT,"Iron Mountain/Kingsfd, MI: Ford",62.0,6.0,5.0,1.0,0.0,0.0,0.0,1.0,1.0,834.0,284.0,550.0,0.0,0.0,0.0
2023,8,OO,SkyWest Airlines Inc.,IND,"Indianapolis, IN: Indianapolis International",96.0,12.0,10.0,1.0,0.0,0.0,1.0,1.0,0.0,750.0,561.0,91.0,0.0,0.0,98.0
2023,8,OO,SkyWest Airlines Inc.,INL,"International Falls, MN: Falls International Einarson Field",52.0,4.0,4.0,0.0,0.0,0.0,0.0,0.0,0.0,343.0,343.0,0.0,0.0,0.0,0.0
2023,8,OO,SkyWest Airlines Inc.,JAC,"Jackson, WY: Jackson Hole",76.0,7.0,7.0,0.0,0.0,0.0,0.0,0.0,1.0,414.0,414.0,0.0,0.0,0.0,0.0
2023,8,OO,SkyWest Airlines Inc.,JAN,"Jackson/Vicksburg, MS: Jackson Medgar Wiley Evers International",20.0,2.0,2.0,0.0,0.0,0.0,0.0,0.0,0.0,135.0,135.0,0.0,0.0,0.0,0.0
2023,8,OO,SkyWest Airlines Inc.,JFK,"New York, NY: John F. Kennedy International",349.0,55.0,26.0,20.0,8.0,1.0,0.0,8.0,0.0,5984.0,3302.0,1902.0,607.0,173.0,0.0
2023,8,OO,SkyWest Airlines Inc.,JLN,"Joplin, MO: Joplin Regional",52.0,8.0,4.0,0.0,0.0,0.0,4.0,1.0,0.0,2929.0,1776.0,0.0,0.0,0.0,1153.0
2023,8,OO,SkyWest Airlines Inc.,JMS,"Jamestown, ND: Jamestown Regional",57.0,6.0,3.0,0.0,0.0,1.0,2.0,0.0,0.0,334.0,236.0,0.0,0.0,19.0,79.0
2023,8,OO,SkyWest Airlines Inc.,JST,"Johnstown, PA: John Murtha Johnstown-Cambria County",62.0,14.0,6.0,0.0,0.0,0.0,8.0,0.0,0.0,1211.0,867.0,0.0,0.0,0.0,344.0
2023,8,OO,SkyWest Airlines Inc.,KTN,"Ketchikan, AK: Ketchikan International",31.0,4.0,2.0,2.0,0.0,0.0,0.0,0.0,0.0,299.0,216.0,83.0,0.0,0.0,0.0
2023,8,OO,SkyWest Airlines Inc.,LAR,"Laramie, WY: Laramie Regional",53.0,22.0,14.0,1.0,0.0,0.0,7.0,0.0,0.0,1460.0,1003.0,111.0,0.0,0.0,346.0
2023,8,OO,SkyWest Airlines Inc.,LAS,"Las Vegas, NV: Harry Reid International",149.0,26.0,12.0,2.0,5.0,0.0,7.0,0.0,2.0,1591.0,322.0,47.0,431.0,0.0,791.0
2023,8,OO,SkyWest Airlines Inc.,LAW,"Lawton/Fort Sill, OK: Lawton-Fort Sill Regional",93.0,8.0,4.0,3.0,0.0,1.0,0.0,1.0,0.0,1354.0,1057.0,216.0,0.0,81.0,0.0
2023,8,OO,SkyWest Airlines Inc.,LAX,"Los Angeles, CA: Los Angeles International",3092.0,306.0,171.0,24.0,21.0,0.0,90.0,25.0,2.0,23846.0,14239.0,1516.0,1428.0,0.0,6663.0
2023,8,OO,SkyWest Airlines Inc.,LBB,"Lubbock, TX: Lubbock Preston Smith International",217.0,36.0,22.0,1.0,0.0,1.0,12.0,1.0,1.0,3333.0,2456.0,41.0,0.0,17.0,819.0
2023,8,OO,SkyWest Airlines Inc.,LBF,"North Platte, NE: North Platte Regional Airport Lee Bird Field",52.0,13.0,5.0,1.0,1.0,0.0,6.0,4.0,0.0,1486.0,922.0,104.0,112.0,0.0,348.0
2023,8,OO,SkyWest Airlines Inc.,LBL,"Liberal, KS: Liberal Mid-America Regional",53.0,7.0,3.0,0.0,0.0,0.0,4.0,0.0,0.0,672.0,448.0,0.0,0.0,0.0,224.0
2023,8,OO,SkyWest Airlines Inc.,LCH,"Lake Charles, LA: Lake Charles Regional",91.0,14.0,10.0,0.0,0.0,0.0,4.0,0.0,0.0,915.0,823.0,0.0,0.0,0.0,92.0
2023,8,OO,SkyWest Airlines Inc.,LEX,"Lexington, KY: Blue Grass",93.0,16.0,13.0,0.0,1.0,0.0,2.0,1.0,0.0,851.0,579.0,0.0,34.0,0.0,238.0
2023,8,OO,SkyWest Airlines Inc.,LFT,"Lafayette, LA: Lafayette Regional Paul Fournet Field",67.0,13.0,8.0,4.0,0.0,0.0,1.0,0.0,1.0,801.0,289.0,484.0,0.0,0.0,28.0
2023,8,OO,SkyWest Airlines Inc.,LGA,"New York, NY: LaGuardia",152.0,19.0,11.0,2.0,3.0,0.0,3.0,3.0,1.0,1528.0,911.0,83.0,199.0,0.0,335.0
2023,8,OO,SkyWest Airlines Inc.,LGB,"Long Beach, CA: Long Beach Airport",93.0,10.0,9.0,1.0,0.0,0.0,0.0,0.0,0.0,322.0,295.0,27.0,0.0,0.0,0.0
2023,8,OO,SkyWest Airlines Inc.,LIT,"Little Rock, AR: Bill and Hillary Clinton Nat Adams Field",124.0,29.0,15.0,1.0,0.0,0.0,13.0,1.0,1.0,2059.0,740.0,22.0,0.0,0.0,1297.0
2023,8,OO,SkyWest Airlines Inc.,LNK,"Lincoln, NE: Lincoln Airport",93.0,20.0,13.0,0.0,1.0,0.0,6.0,0.0,0.0,1274.0,419.0,0.0,70.0,0.0,785.0
2023,8,OO,SkyWest Airlines Inc.,LRD,"Laredo, TX: Laredo International",32.0,2.0,1.0,0.0,0.0,0.0,1.0,0.0,0.0,108.0,77.0,0.0,0.0,0.0,31.0
2023,8,OO,SkyWest Airlines Inc.,LWS,"Lewiston, ID: Lewiston Nez Perce County",62.0,7.0,3.0,0.0,0.0,0.0,4.0,0.0,0.0,487.0,196.0,0.0,0.0,0.0,291.0
2023,8,OO,SkyWest Airlines Inc.,MAF,"Midland/Odessa, TX: Midland International Air and Space Port",31.0,5.0,4.0,0.0,0.0,0.0,1.0,0.0,0.0,243.0,195.0,0.0,0.0,0.0,48.0
2023,8,OO,SkyWest Airlines Inc.,MBS,"Saginaw/Bay City/Midland, MI: MBS International",182.0,35.0,23.0,4.0,1.0,0.0,7.0,3.0,0.0,2544.0,1592.0,245.0,185.0,0.0,522.0
2023,8,OO,SkyWest Airlines Inc.,MCI,"Kansas City, MO: Kansas City International",91.0,15.0,9.0,1.0,0.0,0.0,5.0,0.0,0.0,907.0,621.0,53.0,0.0,0.0,233.0
2023,8,OO,SkyWest Airlines Inc.,MCW,"Mason City, IA: Mason City Municipal",53.0,11.0,6.0,1.0,0.0,0.0,4.0,1.0,0.0,531.0,328.0,92.0,0.0,0.0,111.0
2023,8,OO,SkyWest Airlines Inc.,MDT,"Harrisburg, PA: Harrisburg International",49.0,6.0,4.0,2.0,0.0,0.0,0.0,1.0,0.0,288.0,201.0,87.0,0.0,0.0,0.0
2023,8,OO,SkyWest Airlines Inc.,MDW,"Chicago, IL: Chicago Midway International",178.0,30.0,20.0,7.0,3.0,0.0,0.0,2.0,1.0,2034.0,1322.0,418.0,294.0,0.0,0.0
2023,8,OO,SkyWest Airlines Inc.,MEI,"Meridian, MS: Key Field",53.0,8.0,3.0,0.0,0.0,0.0,5.0,0.0,0.0,3463.0,1055.0,0.0,0.0,0.0,2408.0
2023,8,OO,SkyWest Airlines Inc.,MEM,"Memphis, TN: Memphis International",132.0,30.0,15.0,2.0,1.0,0.0,12.0,0.0,0.0,1626.0,514.0,117.0,48.0,0.0,947.0
2023,8,OO,SkyWest Airlines Inc.,MFE,"Mission/McAllen/Edinburg, TX: McAllen International",3.0,0.0,0.0,0.0,0.0,0.0,0.0,0.0,0.0,0.0,0.0,0.0,0.0,0.0,0.0
2023,8,OO,SkyWest Airlines Inc.,MFR,"Medford, OR: Rogue Valley International - Medford",290.0,26.0,14.0,3.0,1.0,1.0,7.0,0.0,0.0,1960.0,1439.0,88.0,35.0,16.0,382.0
2023,8,OO,SkyWest Airlines Inc.,MGM,"Montgomery, AL: Montgomery Regional",79.0,13.0,9.0,3.0,1.0,0.0,0.0,0.0,0.0,935.0,471.0,445.0,19.0,0.0,0.0
2023,8,OO,SkyWest Airlines Inc.,MHT,"Manchester, NH: Manchester Boston Regional",11.0,4.0,4.0,0.0,0.0,0.0,0.0,0.0,0.0,275.0,275.0,0.0,0.0,0.0,0.0
2023,8,OO,SkyWest Airlines Inc.,MKE,"Milwaukee, WI: General Mitchell International",345.0,84.0,54.0,6.0,1.0,1.0,22.0,5.0,0.0,5806.0,3754.0,304.0,60.0,111.0,1577.0
2023,8,OO,SkyWest Airlines Inc.,MLI,"Moline, IL: Quad Cities International",120.0,35.0,22.0,1.0,2.0,0.0,10.0,1.0,0.0,2444.0,1021.0,159.0,182.0,0.0,1082.0
2023,8,OO,SkyWest Airlines Inc.,MLU,"Monroe, LA: Monroe Regional",29.0,3.0,3.0,0.0,0.0,0.0,0.0,0.0,0.0,84.0,84.0,0.0,0.0,0.0,0.0
2023,8,OO,SkyWest Airlines Inc.,MOT,"Minot, ND: Minot International",182.0,23.0,14.0,2.0,1.0,0.0,6.0,0.0,0.0,2010.0,1419.0,157.0,94.0,0.0,340.0
2023,8,OO,SkyWest Airlines Inc.,MRY,"Monterey, CA: Monterey Regional",296.0,42.0,12.0,5.0,1.0,1.0,23.0,2.0,2.0,2774.0,509.0,696.0,488.0,18.0,1063.0
2023,8,OO,SkyWest Airlines Inc.,MSN,"Madison, WI: Dane County Regional-Truax Field",210.0,31.0,23.0,5.0,1.0,0.0,2.0,2.0,1.0,1983.0,1624.0,237.0,54.0,0.0,68.0
2023,8,OO,SkyWest Airlines Inc.,MSO,"Missoula, MT: Missoula Montana",159.0,13.0,11.0,1.0,0.0,0.0,1.0,0.0,0.0,513.0,375.0,25.0,0.0,0.0,113.0
2023,8,OO,SkyWest Airlines Inc.,MSP,"Minneapolis, MN: Minneapolis-St Paul International",1998.0,168.0,128.0,30.0,9.0,1.0,0.0,1.0,1.0,16191.0,12683.0,2670.0,773.0,65.0,0.0
